{
  "$comment": "Generated by `gwylio schema` from the Pydantic models registered in backend/src/gwylio/infrastructure/config/schemas.py. Do not edit by hand.",
  "$id": "snapshot-requirement-set-summary.schema.json",
  "$schema": "https://json-schema.org/draft/2020-12/schema",
  "additionalProperties": false,
  "description": "One entry of requirement_sets.json, GET /api/v1/requirement-sets.",
  "properties": {
    "id": {
      "title": "Id",
      "type": "string"
    },
    "impact_groups": {
      "title": "Impact Groups",
      "type": "integer"
    },
    "is_default": {
      "title": "Is Default",
      "type": "boolean"
    },
    "name": {
      "title": "Name",
      "type": "string"
    },
    "requirements": {
      "title": "Requirements",
      "type": "integer"
    },
    "source_doc": {
      "title": "Source Doc",
      "type": "string"
    },
    "version": {
      "title": "Version",
      "type": "string"
    },
    "wbo_groups": {
      "title": "Wbo Groups",
      "type": "integer"
    }
  },
  "required": [
    "id",
    "name",
    "version",
    "source_doc",
    "requirements",
    "impact_groups",
    "wbo_groups",
    "is_default"
  ],
  "title": "RequirementSetSummary",
  "type": "object"
}
